{
  "bank_id": "ind_construction",
  "bank_version": "1.0.0",
  "layer": "industry",
  "label": {
    "en": "Construction and specialty trades",
    "fr": "Construction et métiers spécialisés"
  },
  "applies_when": [
    { "field": "base.firmo.q04", "op": "eq", "value": "construction" }
  ],
  "reweight": {
    "scheduling_capacity": 1.4,
    "finance_close": 1.5,
    "performance_management": 1.4,
    "procure_inventory": 1.15,
    "process_documentation": 1.3
  },
  "notes": "GC and sub are different audits. ind_construction.firmo.q01 is the branch: every GC-only question carries show_when in [gc, both], every sub-only question show_when in [sub, both]. The shared questions (WIP, percent-complete method, CCQ, days in AR, daily log) are served to everyone.\n\nreveals keys introduced by this bank, all feeding the cost model: progress_claim_assembly_days, holdback_overdue_amount, unapproved_change_work_share, tm_tickets_signed_unbilled, days_in_ar_construction, ccq_report_prep_hours, equipment_charged_out_to_jobs.\n\nbenchmark_ref keys used and their source: cfma_underbillings_to_equity (CFMA 2025 Construction Financial Benchmarker, underbillings to equity 8.1% all respondents) and cfma_days_in_ar_median (same study, days in AR 55.2 median). No other benchmark on this layer is defensible: change-order revenue as a share of contract, profit fade, holdback days and crew productivity have no published Canadian median, so those questions carry a help line saying we use the client's own number and set no benchmark_ref.\n\nOdoo functional gaps raised as diagnostic questions rather than objections, so the scope conversation happens inside the audit: holdback/retainage withholding and sub-ledger (fin.q02), progress billing against a schedule of values (q2c.q03), WIP and percentage-of-completion computation (fin.q03, fin.q04), committed-cost reporting (fin.q01), the change-event to PCO to owner-CO chain (q2c.q02), equipment charge-out at an internal rate (inv.q02), crew-based field time capture by cost code (sys.q01), subcontractor compliance document expiry (comp.q01), and CCQ monthly report output, which is absent because Canadian payroll in Odoo is thin and union reporting needs an external provider (comp.q03).\n\nLegal care: no Quebec prompt-payment threshold, tier day-count or holdback percentage is asserted anywhere in this bank. The Quebec research flags those as law-firm-sourced. comp.q02 asks who watches the clock and in what tool, and leaves the rule itself for the consultant to confirm on the client's actual contracts. Quebec has no statutory private holdback regime, so fin.q02 is phrased around the release date in the contract, not a statutory date.",
  "questions": [
    {
      "id": "ind_construction.firmo.q01",
      "dimension": "firmographic",
      "type": "single",
      "weight": 0,
      "stem": {
        "en": "On most of your work, which side of the contract are you on?",
        "fr": "Sur la majorité de vos travaux, de quel côté du contrat êtes-vous?"
      },
      "help": {
        "en": "This changes the rest of the questions. A general contractor's audit and a trade contractor's audit are not the same audit.",
        "fr": "Cela change la suite des questions. L'examen d'un entrepreneur général et celui d'un entrepreneur spécialisé ne sont pas le même examen."
      },
      "instruments": ["quiz", "audit"],
      "notes": "The branch for the whole bank. 'both' serves the GC and the sub questions, which is correct for a firm that primes some work and subs the rest — a common Quebec shape.",
      "options": [
        {
          "value": "gc",
          "label": {
            "en": "We hold the prime contract with the owner — general contractor or construction manager",
            "fr": "Nous détenons le contrat principal avec le client — entrepreneur général ou gérant de construction"
          },
          "informational": true
        },
        {
          "value": "sub",
          "label": {
            "en": "We work as a specialty trade subcontractor under a general contractor",
            "fr": "Nous travaillons comme sous-traitant spécialisé pour un entrepreneur général"
          },
          "informational": true
        },
        {
          "value": "both",
          "label": {
            "en": "Both — we prime some jobs and sub on others",
            "fr": "Les deux — nous sommes entrepreneur principal sur certains chantiers et sous-traitant sur d'autres"
          },
          "informational": true
        },
        {
          "value": "owner_builder",
          "label": {
            "en": "We build for ourselves — owner-builder, we don't contract to a third party",
            "fr": "Nous construisons pour nous-mêmes — constructeur-propriétaire, sans contrat avec un tiers"
          },
          "informational": true
        }
      ]
    },
    {
      "id": "ind_construction.fin.q03",
      "dimension": "finance_close",
      "type": "single",
      "weight": 1.5,
      "stem": {
        "en": "Your over-billing and under-billing position by job: who prepares that, and how often?",
        "fr": "Votre position de surfacturation et de sous-facturation par chantier : qui la prépare, et à quelle fréquence?"
      },
      "help": {
        "en": "The WIP schedule. It is the first thing a surety or a banker asks for, and the first place profit fade shows up.",
        "fr": "Le tableau des travaux en cours (WIP). C'est la première chose qu'un assureur-caution ou un banquier demande, et le premier endroit où l'érosion de la marge apparaît."
      },
      "instruments": ["quiz", "audit"],
      "benchmark_ref": "cfma_underbillings_to_equity",
      "artifact_probe": {
        "en": "Open your most recent WIP schedule and show me the three largest jobs, with cost to complete and the forecast gross margin on each.",
        "fr": "Ouvrez votre plus récent tableau des travaux en cours et montrez-moi les trois plus gros chantiers, avec le coût à terminer et la marge brute prévue sur chacun."
      },
      "notes": "Odoo gap: WIP and percentage-of-completion are not computed. There is no earned-revenue journal, no over/under-billing calculation and no cost-to-complete field. Raise it here, so the custom WIP model or the spreadsheet discipline is in scope before signature, not after. 'Our external accountant prepares it quarterly' is a scored level 2, not missing data — it is the single most common answer in this sector and it means management flies blind between quarters.",
      "options": [
        {
          "value": "nobody",
          "label": {
            "en": "We don't produce one — nobody here could tell you that number",
            "fr": "Nous n'en produisons pas — personne ici ne pourrait vous donner ce chiffre"
          },
          "level": 1
        },
        {
          "value": "external_quarterly",
          "label": {
            "en": "Our external accountant prepares it quarterly, or at year end",
            "fr": "Notre comptable externe le prépare trimestriellement, ou à la fin de l'exercice"
          },
          "level": 2
        },
        {
          "value": "internal_spreadsheet",
          "label": {
            "en": "Someone here rebuilds it monthly in a spreadsheet",
            "fr": "Quelqu'un ici le refait chaque mois dans un chiffrier"
          },
          "level": 3
        },
        {
          "value": "system_monthly",
          "label": {
            "en": "It comes out of our job cost system monthly, with cost to complete entered by the project managers",
            "fr": "Il sort de notre système de coûts de projet chaque mois, avec le coût à terminer saisi par les chargés de projet"
          },
          "level": 4
        },
        {
          "value": "system_reviewed",
          "label": {
            "en": "That, and we compare each job's forecast margin to the previous month and work through every job that moved",
            "fr": "Cela, et nous comparons la marge prévue de chaque chantier au mois précédent et examinons chaque chantier qui a bougé"
          },
          "level": 5
        }
      ]
    },
    {
      "id": "ind_construction.q2c.q01",
      "dimension": "quote_to_cash",
      "type": "single",
      "weight": 1.5,
      "stem": {
        "en": "You win a job. What happens to the estimate — does it become the budget at the same level of detail, or does someone re-type a summary?",
        "fr": "Vous décrochez un chantier. Qu'arrive-t-il à l'estimation — devient-elle le budget au même niveau de détail, ou quelqu'un ressaisit-il un sommaire?"
      },
      "instruments": ["audit"],
      "show_when": [{ "field": "ind_construction.firmo.q01", "op": "in", "value": ["gc", "both"] }],
      "artifact_probe": {
        "en": "Put the takeoff and estimate for your last award beside the budget in your accounting system, and let's match three lines.",
        "fr": "Placez le métré et l'estimation de votre dernière adjudication à côté du budget dans votre système comptable, et apparions trois lignes."
      },
      "notes": "The estimate dying at award is the structural break in GC job costing: the bid line, the subcontract and the cost code lose their link permanently and nothing is learned from one job to the next. Odoo implication: cost codes have to be built as an analytic plan (client's own structure or MasterFormat divisions) and getting the coding structure wrong at go-live is not recoverable without a data migration.",
      "options": [
        {
          "value": "no_budget",
          "label": {
            "en": "There's no job budget in the system — we compare costs to the contract price",
            "fr": "Il n'y a pas de budget de chantier dans le système — nous comparons les coûts au prix du contrat"
          },
          "level": 1
        },
        {
          "value": "summary_retyped",
          "label": {